{
  "id": "step-0042",
  "state_summary": {
    "t": 1.25,
    "dt": 0.05,
    "state_hash": "statehash-abc"
  },
  "residuals": {
    "cons": 0.9,
    "rec": 0.7,
    "tool": 0.2
  },
  "debt": 1.42,
  "debt_decomposition": {
    "cons": 0.81,
    "rec": 0.49,
    "tool": 0.04,
    "thrash": 0.08
  },
  "gates": {
    "hard": "pass",
    "soft": "pass",
    "reason": "soft fail on initial proposal; dt rail applied"
  },
  "actions": [
    {
      "rail": "reduce_dt",
      "bounds": { "min_dt": 0.01, "factor": 0.5 },
      "before": { "dt": 0.1, "soft_gate": "fail" },
      "after": { "dt": 0.05, "soft_gate": "pass" }
    }
  ],
  "decision": "accept",
  "parent_hash": "prevhash-123",
  "receipt_hash": "rechash-456",
  "timestamp": "2025-01-01T00:00:00Z"
}
